{
  "$schema": "http://json-schema.org/draft-07/schema#",
  "title": "CNC Plugin Manifest Schema",
  "type": "object",
  "required": ["id", "name", "version", "description", "author", "mainView", "entryPoint", "apiVersion", "enabled", "permissions"],
  "properties": {
    "id": {
      "type": "string",
      "pattern": "^[a-z0-9.-]+$",
      "description": "Unique plugin identifier (lowercase, numbers, hyphens, dots)",
      "minLength": 3,
      "maxLength": 50
    },
    "name": {
      "type": "string",
      "minLength": 1,
      "maxLength": 100,
      "description": "Human-readable plugin name"
    },
    "version": {
      "type": "string",
      "pattern": "^\\d+\\.\\d+\\.\\d+$",
      "description": "Semantic version (major.minor.patch)"
    },
    "description": {
      "type": "string",
      "minLength": 10,
      "maxLength": 500,
      "description": "Brief description of plugin functionality"
    },
    "author": {
      "type": "string",
      "minLength": 1,
      "maxLength": 100,
      "description": "Plugin author or organization"
    },
    "entryPoint": {
      "type": "string",
      "description": "JavaScript entry file",
      "default": "plugin.js"
    },
    "apiVersion": {
      "type": "string",
      "pattern": "^\\d+\\.\\d+\\.\\d+$",
      "description": "Plugin API version compatibility",
      "default": "1.0.0"
    },
    "mainView": {
      "type": "string",
      "enum": ["dashboard", "standalone", "modal", "sidebar"],
      "description": "View type determines UI placement"
    },
    "enabled": {
      "type": "boolean",
      "description": "Whether plugin is enabled by default",
      "default": true
    },
    "permissions": {
      "type": "array",
      "items": {
        "type": "string",
        "enum": [
          "state",
          "events",
          "services",
          "logger",
          "machine.read",
          "machine.write",
          "machine.control",
          "status.read",
          "files.read",
          "files.write",
          "config.read",
          "config.write",
          "network.access"
        ]
      },
      "uniqueItems": true,
      "description": "Required permissions for plugin operation"
    },
    "license": {
      "type": "string",
      "description": "Software license identifier",
      "default": "MIT"
    },
    "homepage": {
      "type": "string",
      "pattern": "^https?://",
      "description": "Plugin homepage URL"
    },
    "repository": {
      "oneOf": [
        {
          "type": "string",
          "pattern": "^https?://",
          "description": "Repository URL"
        },
        {
          "type": "object",
          "properties": {
            "type": {
              "type": "string",
              "enum": ["git", "svn", "hg"]
            },
            "url": {
              "type": "string",
              "pattern": "^https?://"
            }
          },
          "required": ["type", "url"]
        }
      ]
    },
    "keywords": {
      "type": "array",
      "items": {
        "type": "string",
        "minLength": 2,
        "maxLength": 20
      },
      "maxItems": 10,
      "description": "Search keywords for the plugin"
    },
    "category": {
      "type": "string",
      "enum": ["monitoring", "control", "visualization", "utility", "automation", "management"],
      "description": "Primary plugin category"
    },
    "size": {
      "type": "object",
      "properties": {
        "width": {
          "oneOf": [
            {"type": "number", "minimum": 200},
            {"type": "string", "enum": ["auto"]}
          ]
        },
        "height": {
          "oneOf": [
            {"type": "number", "minimum": 150},
            {"type": "string", "enum": ["auto"]}
          ]
        }
      },
      "additionalProperties": false
    },
    "priority": {
      "type": "number",
      "minimum": 1,
      "maximum": 100,
      "description": "Display priority (1 = highest)",
      "default": 50
    },
    "autoStart": {
      "type": "boolean",
      "description": "Whether plugin starts automatically",
      "default": false
    },
    "menuTitle": {
      "type": "string",
      "minLength": 1,
      "maxLength": 30,
      "description": "Menu title for standalone plugins"
    },
    "menuIcon": {
      "type": "string",
      "description": "Icon name for menu (Ant Design icons)"
    },
    "routePath": {
      "type": "string",
      "pattern": "^/[a-z0-9-/]*$",
      "description": "Custom route path for standalone plugins"
    },
    "compatibility": {
      "type": "object",
      "properties": {
        "minAppVersion": {
          "type": "string",
          "pattern": "^\\d+\\.\\d+\\.\\d+$"
        },
        "maxAppVersion": {
          "type": "string",
          "pattern": "^\\d+\\.\\d+\\.\\d+$"
        }
      },
      "required": ["minAppVersion"],
      "description": "Application version compatibility"
    },
    "dependencies": {
      "type": "object",
      "patternProperties": {
        "^[a-zA-Z0-9@/-]+$": {
          "type": "string"
        }
      },
      "description": "NPM-style dependency declarations"
    },
    "screenshots": {
      "type": "array",
      "items": {
        "type": "string",
        "pattern": "^https?://"
      },
      "maxItems": 5,
      "description": "Screenshot URLs for plugin gallery"
    },
    "changelog": {
      "type": "string",
      "pattern": "^https?://",
      "description": "URL to changelog document"
    },
    "card": {
      "type": "object",
      "description": "Dashboard card configuration (for mainView: 'dashboard')",
      "properties": {
        "template": {
          "type": "string",
          "enum": ["StatusCard", "DataDisplayCard", "UploadCard", "ListCard", "ActionCard", "MediaPlayerCard"],
          "description": "Card template to use (optional: if not specified, renders plugin iframe)"
        },
        "templateData": {
          "type": "object",
          "description": "Data for the card template (template-specific structure)"
        },
        "title": {
          "type": "string",
          "description": "Custom card title (overrides plugin name)"
        },
        "icon": {
          "type": "string",
          "description": "Card icon"
        },
        "cols": {
          "type": "number",
          "minimum": 1,
          "maximum": 12,
          "description": "Number of columns to span (1-12)"
        },
        "width": {
          "type": "string",
          "description": "CSS width value (e.g., '33%', '400px', 'auto')"
        },
        "height": {
          "oneOf": [
            {"type": "string"},
            {"type": "string", "enum": ["auto"]}
          ],
          "description": "CSS height value or 'auto'"
        },
        "responsive": {
          "type": "object",
          "description": "Responsive column configuration",
          "properties": {
            "xs": {"type": "number", "minimum": 1, "maximum": 12},
            "sm": {"type": "number", "minimum": 1, "maximum": 12},
            "md": {"type": "number", "minimum": 1, "maximum": 12},
            "lg": {"type": "number", "minimum": 1, "maximum": 12},
            "xl": {"type": "number", "minimum": 1, "maximum": 12}
          },
          "additionalProperties": false
        },
        "priority": {
          "type": "number",
          "description": "Display priority (supports decimals, lower renders first)"
        }
      },
      "additionalProperties": false
    }
  },
  "additionalProperties": false
}
