{
  "id": "quick-settings",
  "name": "Quick Settings",
  "version": "1.0.0",
  "description": "Quick Settings plugin for CNC Controls application. Provides fast access to common machine settings and controls in a modal dialog interface.",
  "author": "Whttlr",
  "entryPoint": "plugin.js",
  "apiVersion": "1.0.0",
  "mainView": "modal",
  "enabled": true,
  "permissions": ["state", "events", "logger"],
  "license": "MIT",
  "keywords": ["modal", "settings", "cnc", "control"],
  "category": "utility",
  "compatibility": {
    "minAppVersion": "1.0.0",
    "maxAppVersion": "2.0.0"
  }
}
