{
  "id": "gcode-snippets",
  "name": "G-Code Snippets",
  "version": "1.1.0",
  "description": "Quick access to common G-code commands and snippets with customizable library and one-click insertion",
  "author": "CNC Controls Team",
  "entryPoint": "plugin.js",
  "apiVersion": "1.0.0",
  "mainView": "standalone",
  "enabled": true,
  "permissions": ["state", "events", "logger", "files.read", "files.write", "machine.write"],
  "license": "MIT",
  "homepage": "https://github.com/whttlr/gcode-snippets-plugin",
  "repository": {
    "type": "git",
    "url": "https://github.com/whttlr/gcode-snippets-plugin.git"
  },
  "keywords": ["gcode", "snippets", "productivity", "commands"],
  "category": "utility",
  "menuTitle": "G-Code Snippets",
  "menuIcon": "CodeOutlined",
  "routePath": "/gcode-snippets",
  "size": {
    "width": "auto",
    "height": "auto"
  },
  "priority": 10,
  "autoStart": false,
  "compatibility": {
    "minAppVersion": "1.0.0",
    "maxAppVersion": "2.0.0"
  },
  "dependencies": {
    "react": "^18.0.0",
    "antd": "^5.0.0",
    "monaco-editor": "^0.43.0"
  },
  "screenshots": [
    "https://raw.githubusercontent.com/whttlr/gcode-snippets-plugin/main/screenshots/main-view.png",
    "https://raw.githubusercontent.com/whttlr/gcode-snippets-plugin/main/screenshots/editor.png"
  ],
  "changelog": "https://raw.githubusercontent.com/whttlr/gcode-snippets-plugin/main/CHANGELOG.md"
}
